{
  "$schema": "../../.schemas/src/pages/Home.Home.schema.json",
  "Enjoy full TypeScript support with automatically generated translation schemas.": "Disfrute de soporte completo de TypeScript con esquemas de traducción generados automáticamente.",
  "Get Started": "Empezar",
  "Just call zintl() and let the compiler do the rest of the heavy lifting for you.": "Solo llame a zintl() y deje que el compilador haga el resto del trabajo pesado por usted.",
  "Learn More": "Saber más",
  "Only load what you need, when you need it. Smallest runtime footprint in the industry.": "Cargue solo lo que necesite, cuando lo necesite. La huella de tiempo de ejecución más pequeña de la industria.",
  "Optimized": "Optimizado",
  "Powerful I18n for Modern Apps": "I18n potente para aplicaciones modernas",
  "Type Safe": "Seguridad de tipos",
  "Zero Config": "Cero configuración",
  "Zintl Visualization": "Visualización de Zintl",
  "Zintl transforms your static strings into optimized, chunk-aware translation catalogs. Experience the future of internationalization today!": "Zintl transforma sus cadenas estáticas en catálogos de traducción optimizados y conscientes de los fragmentos.\n          ¡Experimente el futuro de la internacionalización hoy mismo!"
}
